{"cotangentSplit":{"rdata":{"kind":"tuple","items":[{"kind":"none","name":"NoRData"},{"kind":"number","value":1.0}]},"output":{"kind":"tuple","items":[{"kind":"vector","items":[{"kind":"number","value":1.0},{"kind":"number","value":1.0},{"kind":"number","value":1.0}]},{"kind":"number","value":1.0}]},"outputType":"Tuple{Vector{Float64}, Float64}","fdata":{"kind":"tuple","items":[{"kind":"vector","items":[{"kind":"number","value":1.0},{"kind":"number","value":1.0},{"kind":"number","value":1.0}]},{"kind":"none","name":"NoFData"}]}},"result":{"checks":[{"name":"gradient matches Mooncake.value_and_pullback!!","passed":true,"want":[2.0,2.0,2.0],"got":[2.0,2.0,2.0]}],"primalValue":{"kind":"tuple","items":[{"kind":"vector","items":[{"kind":"number","value":1.0},{"kind":"number","value":2.0},{"kind":"number","value":3.0}]},{"kind":"number","value":6.0}]},"gradient":{"kind":"vector","items":[{"kind":"number","value":2.0},{"kind":"number","value":2.0},{"kind":"number","value":2.0}]}},"steps":[{"explanation":"Reads a value captured by the forward pass and shared with the reverse pass.","stage":"fwd_ir","produced":{"kind":"stack","items":[],"size":0},"index":1,"pc":1,"ssaId":"%1","kind":"shared-data","mutatesPrimal":false,"phase":"forward","block":1,"text":"%1 = (get_shared_data_field)(_1, 1)","type":"Any"},{"explanation":"Reads a value captured by the forward pass and shared with the reverse pass.","stage":"fwd_ir","produced":{"kind":"ref","refType":"Tuple{LazyZeroRData{typeof(vpair), Nothing}, LazyZeroRDat…","value":{"kind":"tuple","items":[{"kind":"struct","fields":[{"name":"data","value":{"kind":"nothing"}}],"type":"LazyZeroRData{typeof(vpair), Nothing}"},{"kind":"struct","fields":[{"name":"data","value":{"kind":"nothing"}}],"type":"LazyZeroRData{Vector{Float64}, Nothing}"}]}},"index":2,"pc":2,"ssaId":"%2","kind":"shared-data","mutatesPrimal":false,"phase":"forward","block":1,"text":"%2 = (get_shared_data_field)(_1, 2)","type":"Any"},{"explanation":"Reads a value captured by the forward pass and shared with the reverse pass.","stage":"fwd_ir","produced":{"kind":"stack","items":[],"size":0},"index":3,"pc":3,"ssaId":"%3","kind":"shared-data","mutatesPrimal":false,"phase":"forward","block":1,"text":"%3 = (get_shared_data_field)(_1, 3)","type":"Any"},{"explanation":"Builds or instantiates reverse-data (rdata) — the value-like part of a gradient.","stage":"fwd_ir","produced":{"kind":"tuple","items":[{"kind":"struct","fields":[{"name":"data","value":{"kind":"nothing"}}],"type":"LazyZeroRData{typeof(vpair), Nothing}"},{"kind":"struct","fields":[{"name":"data","value":{"kind":"nothing"}}],"type":"LazyZeroRData{Vector{Float64}, Nothing}"}]},"index":4,"pc":4,"ssaId":"%4","kind":"rdata","mutatesPrimal":false,"phase":"forward","block":1,"text":"%4 = (__assemble_lazy_zero_rdata)(%2, _2, _3)","type":"Any"},{"explanation":"Wraps a constant in a CoDual so it can flow through an rrule.","stage":"fwd_ir","produced":{"kind":"codual","primalType":"typeof(copy)","primal":{"kind":"fn","name":"#copy"},"tangent":{"kind":"none","name":"NoFData"}},"index":5,"pc":5,"ssaId":"%5","kind":"wrap","mutatesPrimal":false,"phase":"forward","block":2,"text":"%5 = (uninit_fcodual)(copy)","type":"Any"},{"explanation":"Runs Mooncake's rrule for a primitive: produces the forward output CoDual and a pullback.","stage":"fwd_ir","produced":{"kind":"tuple","items":[{"kind":"codual","primalType":"Vector{Float64}","primal":{"kind":"vector","items":[{"kind":"number","value":1.0},{"kind":"number","value":2.0},{"kind":"number","value":3.0}]},"tangent":{"kind":"vector","items":[{"kind":"number","value":1.0},{"kind":"number","value":1.0},{"kind":"number","value":1.0}]}},{"kind":"pullback","name":"copy_pullback!!"}]},"index":6,"pc":6,"ssaId":"%6","kind":"rrule","mutatesPrimal":false,"phase":"forward","block":2,"text":"%6 = (rrule!!)(%5, _3)","type":"Any"},{"explanation":"Unpacks a tuple field — typically the output CoDual or the pullback from an rrule call.","stage":"fwd_ir","produced":{"kind":"codual","primalType":"Vector{Float64}","primal":{"kind":"vector","items":[{"kind":"number","value":1.0},{"kind":"number","value":2.0},{"kind":"number","value":3.0}]},"tangent":{"kind":"vector","items":[{"kind":"number","value":1.0},{"kind":"number","value":1.0},{"kind":"number","value":1.0}]}},"index":7,"pc":7,"ssaId":"%7","kind":"getfield","mutatesPrimal":false,"phase":"forward","block":2,"text":"%7 = (getfield)(%6, 1)","type":"Any"},{"explanation":"Unpacks a tuple field — typically the output CoDual or the pullback from an rrule call.","stage":"fwd_ir","produced":{"kind":"pullback","name":"copy_pullback!!"},"index":8,"pc":8,"ssaId":"%8","kind":"getfield","mutatesPrimal":false,"phase":"forward","block":2,"text":"%8 = (getfield)(%6, 2)","type":"var\"#copy_pullback!!#rrule!!##126\"{Vector{Float64}, Vector{Float64}}"},{"explanation":"Asserts the inferred type of a CoDual; a no-op at runtime.","stage":"fwd_ir","produced":{"kind":"codual","primalType":"Vector{Float64}","primal":{"kind":"vector","items":[{"kind":"number","value":1.0},{"kind":"number","value":2.0},{"kind":"number","value":3.0}]},"tangent":{"kind":"vector","items":[{"kind":"number","value":1.0},{"kind":"number","value":1.0},{"kind":"number","value":1.0}]}},"index":9,"pc":9,"ssaId":"%9","kind":"typeassert","mutatesPrimal":false,"phase":"forward","block":2,"text":"%9 = (typeassert)(%7, CoDual{Vector{Float64}, Vector{Float64}})","type":"Any"},{"explanation":"Wraps a constant in a CoDual so it can flow through an rrule.","stage":"fwd_ir","produced":{"kind":"codual","primalType":"typeof(sum)","primal":{"kind":"fn","name":"#sum"},"tangent":{"kind":"none","name":"NoFData"}},"index":10,"pc":10,"ssaId":"%10","kind":"wrap","mutatesPrimal":false,"phase":"forward","block":2,"text":"%10 = (uninit_fcodual)(sum)","type":"Any"},{"explanation":"Runs Mooncake's rrule for a primitive: produces the forward output CoDual and a pullback.","stage":"fwd_ir","produced":{"kind":"tuple","items":[{"kind":"codual","primalType":"Float64","primal":{"kind":"number","value":6.0},"tangent":{"kind":"none","name":"NoFData"}},{"kind":"pullback","name":"sum_pb!!"}]},"index":11,"pc":11,"ssaId":"%11","kind":"rrule","mutatesPrimal":false,"phase":"forward","block":2,"text":"%11 = (rrule!!)(%10, _3)","type":"Any"},{"explanation":"Unpacks a tuple field — typically the output CoDual or the pullback from an rrule call.","stage":"fwd_ir","produced":{"kind":"codual","primalType":"Float64","primal":{"kind":"number","value":6.0},"tangent":{"kind":"none","name":"NoFData"}},"index":12,"pc":12,"ssaId":"%12","kind":"getfield","mutatesPrimal":false,"phase":"forward","block":2,"text":"%12 = (getfield)(%11, 1)","type":"Any"},{"explanation":"Unpacks a tuple field — typically the output CoDual or the pullback from an rrule call.","stage":"fwd_ir","produced":{"kind":"pullback","name":"sum_pb!!"},"index":13,"pc":13,"ssaId":"%13","kind":"getfield","mutatesPrimal":false,"phase":"forward","block":2,"text":"%13 = (getfield)(%11, 2)","type":"var\"#sum_pb!!#rrule!!##128\"{Float64, Vector{Float64}}"},{"explanation":"Asserts the inferred type of a CoDual; a no-op at runtime.","stage":"fwd_ir","produced":{"kind":"codual","primalType":"Float64","primal":{"kind":"number","value":6.0},"tangent":{"kind":"none","name":"NoFData"}},"index":14,"pc":14,"ssaId":"%14","kind":"typeassert","mutatesPrimal":false,"phase":"forward","block":2,"text":"%14 = (typeassert)(%12, CoDual{Float64, NoFData})","type":"Any"},{"explanation":"Wraps a constant in a CoDual so it can flow through an rrule.","stage":"fwd_ir","produced":{"kind":"codual","primalType":"typeof(tuple)","primal":{"kind":"fn","name":"#tuple"},"tangent":{"kind":"none","name":"NoFData"}},"index":15,"pc":15,"ssaId":"%15","kind":"wrap","mutatesPrimal":false,"phase":"forward","block":2,"text":"%15 = (uninit_fcodual)(tuple)","type":"Any"},{"explanation":"Runs Mooncake's rrule for a primitive: produces the forward output CoDual and a pullback.","stage":"fwd_ir","produced":{"kind":"tuple","items":[{"kind":"codual","primalType":"Tuple{Vector{Float64}, Float64}","primal":{"kind":"tuple","items":[{"kind":"vector","items":[{"kind":"number","value":1.0},{"kind":"number","value":2.0},{"kind":"number","value":3.0}]},{"kind":"number","value":6.0}]},"tangent":{"kind":"tuple","items":[{"kind":"vector","items":[{"kind":"number","value":1.0},{"kind":"number","value":1.0},{"kind":"number","value":1.0}]},{"kind":"none","name":"NoFData"}]}},{"kind":"struct","fields":[],"type":"TuplePullback{2}"}]},"index":16,"pc":16,"ssaId":"%16","kind":"rrule","mutatesPrimal":false,"phase":"forward","block":2,"text":"%16 = (rrule!!)(%15, %9, %14)","type":"Any"},{"explanation":"Unpacks a tuple field — typically the output CoDual or the pullback from an rrule call.","stage":"fwd_ir","produced":{"kind":"codual","primalType":"Tuple{Vector{Float64}, Float64}","primal":{"kind":"tuple","items":[{"kind":"vector","items":[{"kind":"number","value":1.0},{"kind":"number","value":2.0},{"kind":"number","value":3.0}]},{"kind":"number","value":6.0}]},"tangent":{"kind":"tuple","items":[{"kind":"vector","items":[{"kind":"number","value":1.0},{"kind":"number","value":1.0},{"kind":"number","value":1.0}]},{"kind":"none","name":"NoFData"}]}},"index":17,"pc":17,"ssaId":"%17","kind":"getfield","mutatesPrimal":false,"phase":"forward","block":2,"text":"%17 = (getfield)(%16, 1)","type":"Any"},{"explanation":"A no-op (an elided bounds check).","stage":"fwd_ir","produced":{"kind":"nothing"},"index":18,"pc":18,"ssaId":"%18","kind":"nop","mutatesPrimal":false,"phase":"forward","block":2,"text":"%18 = nop","type":"Any"},{"explanation":"Asserts the inferred type of a CoDual; a no-op at runtime.","stage":"fwd_ir","produced":{"kind":"codual","primalType":"Tuple{Vector{Float64}, Float64}","primal":{"kind":"tuple","items":[{"kind":"vector","items":[{"kind":"number","value":1.0},{"kind":"number","value":2.0},{"kind":"number","value":3.0}]},{"kind":"number","value":6.0}]},"tangent":{"kind":"tuple","items":[{"kind":"vector